{"artifacts":{"entry_path":"docs/superpowers/evidence/p0-1/p0-1-entry-baseline.json","receipt_path":"docs/superpowers/evidence/p0-1/p0-1-entry-baseline.receipt.json"},"base_main_heads":{"cc_gateway":"9ca9ea72d881fccd2cfb3fd1b939a2f56db69516","sub2api":"d5a42bbd24d15af2ce7646d050a5ae5c77911d4f"},"capture_inputs":{"capture_tool":{"digest":"sha256:32ff56f18b59688d86925558c4370fe01a6135c4958f6434f9be0c6cfd3b44c5","path":"tools/oracle-lab/governance-amendment-entry.ts"},"entry_schema":{"digest":"sha256:b692470449826fcd3c8ab19525ae4cb1d1c45f98ee8f2bfc5557165a1ec3880b","path":"docs/superpowers/schemas/oracle-lab-governance-amendment-entry.schema.json"},"receipt_schema":{"digest":"sha256:937f1298d55018781e751cd847be237e2a066cd53f390f060acdcfc6c0cfb54b","path":"docs/superpowers/schemas/oracle-lab-governance-amendment-entry-receipt.schema.json"}},"codegraph":{"cc_gateway":{"edge_count":12879,"file_count":105,"index_digest":"sha256:352a17c60a6a28e7e8844f103a09c9cfbd239dcc1426237cb5c6eccfc87cf4bb","node_count":3379,"up_to_date":true,"version":"1.1.6"},"sub2api":{"edge_count":328728,"file_count":3042,"index_digest":"sha256:9d83aeab8505b213b903be1c1112afb3bbc89d1390789e0b0115364cb876c7e8","node_count":98075,"up_to_date":true,"version":"1.1.6"}},"compatibility_policy":"phase_0_additive_only_breaking_requires_new_version_and_migration_test","destruction_procedure":"git_revert_artifact_commit_after_security_approval","disabled_capabilities":["real_upstream_access","real_credentials","provider_internal_authority","profile_promotion","production_deployment","real_canary","direct_egress_trust","unverified_pinned_wire_claims","unsupported_negative_capabilities","expired_or_missing_negative_capabilities","unrestricted_capture","external_network_requests"],"entry_kind":"governance_amendment_entry","generated_at":"2026-07-12T21:41:35.241Z","p0_1_scope":{"in_scope":["adopt_and_correct_review_amendment","overlay_prior_specifications","preserve_seven_phases_with_mandatory_3b_3_5","wp_r0_through_wp_r9_traceability_umbrellas","requirement_registry_v2_and_v1_migration","register_18_ra_requirements_as_deferred","claim_matrix_prohibited_conclusions","ra_current_observation_ledger","bounded_ra_current_009_four_local_test_yaml_repairs","two_joint_tests_in_successor_cross_repository_green_inventory","successor_p0_1_evidence_chain","exact_p1_entry_conditions"],"out_of_scope":["b1_through_b3_implementation","b4_through_b6_implementation","shared_readiness_handshake_or_contract_redesign","profile_compiler_profile_or_evidence_factory_implementation","account_policy_replay_response_scheduler_or_replica_runtime_work","large_scale_proxy_refactor","production_credentials_external_network_canary_or_promotion","historical_phase_zero_or_post_integration_evidence_mutation"],"release":"P0.1","requirement_ids":["HA-P0-004","HA-P0-007","RA-P0-001"],"work_package":"WP-R0"},"parent_receipts":{"phase_zero":{"digest":"sha256:5a2bef840e04d6533bfc657520c73cbc8fcc5f27ede181d168d9b2bf8a3fedee","path":"docs/superpowers/evidence/phase-0/phase-0-exit-receipt.json"},"post_integration_v2":{"digest":"sha256:c6b64e233dfa2df8c4cd8937aa2b8552ac54c68d4593a32a837af20d4923fb64","path":"docs/superpowers/evidence/post-integration-v2/post-integration-receipt.json"}},"redaction_policy":"digests_and_safe_redacted_excerpts_only","repositories":{"cc_gateway":{"base_main_head":"9ca9ea72d881fccd2cfb3fd1b939a2f56db69516","branch":"codex/oracle-p0-1-governance","clean":true,"descends_from_base_main":true,"dirty_digest":"sha256:e3b0c44298fc1c149afbf4c8996fb92427ae41e4649b934ca495991b7852b855","head":"4b52677dbceef446e63bc207a795c84b872f38dd","user_fork_main":{"commit":"9ca9ea72d881fccd2cfb3fd1b939a2f56db69516","name":"muqihang","ref":"refs/remotes/muqihang/main","url_digest":"sha256:52de8ee497a784b90b33345865754f3e6b9d5d96eed92549a15a4157cabb568a"}},"sub2api":{"base_main_head":"d5a42bbd24d15af2ce7646d050a5ae5c77911d4f","branch":"codex/oracle-p0-1-governance","clean":true,"descends_from_base_main":true,"dirty_digest":"sha256:e3b0c44298fc1c149afbf4c8996fb92427ae41e4649b934ca495991b7852b855","head":"d5a42bbd24d15af2ce7646d050a5ae5c77911d4f","user_fork_main":{"commit":"d5a42bbd24d15af2ce7646d050a5ae5c77911d4f","name":"muqihang","ref":"refs/remotes/muqihang/main","url_digest":"sha256:22c1a9e3cf8e76d2a20bf24a1ff66fa5d7417ba8b8b83a948c8b3ffa5c33a1a9"}}},"retention_class":"phase_evidence_permanent","review_amendment":{"source_digest":"sha256:76e662ede1e113018eb5bf8cb835e2e825ae094d426a1c73c4af17f8a643dbf4"},"reviewed_tool_head":"4b52677dbceef446e63bc207a795c84b872f38dd","runtime":{"codegraph":"sha256:04d8966c7aad626e657e229f411cca5d32f69c1ae76f06e93542ac6b5ef12d47","git":"sha256:74d9e1a39c1204fdcd5444ef60250735f463db4898a2e813c4fa937720fb6943","go":"sha256:c266e37e7c412841c14de5c89a6507af96bb5427e0288f2578f940a0aea6577a","network_policy":"sha256:4e20706b83e881d179584e628cda88de820eebd1fecca7ac93fd8c2e7cac0b75","node":"sha256:e9adcddb6d8bf4f8ae039a685ffbfbfc43ec9a737ef7f8b021fbd80cb51a547f","npm":"sha256:de2f0aa452a648a7039bfc2984089aafc6847ed84f69ca45d157dcea258c681d"},"schema_version":1,"shared_contract":{"digest":"sha256:70c26db06e9135db31d08f097573e3fd55bd9a8894614832eefeecabf6b1a3d1","path":"backend/internal/service/testdata/cc_gateway_formal_pool_contract/vectors.json","repository":"sub2api"}}
